fileId,orgin_fileId,title,url,keywords,description,source,author,date,year,domainName,websiteName,views,comments,likes,forwardings,language,area,title_in_article,news_category,Unnamed: 19,Unnamed: 20,Unnamed: 21,Unnamed: 22,Unnamed: 23,Unnamed: 24,Unnamed: 25,Unnamed: 26,Unnamed: 27,Unnamed: 28,Unnamed: 29,Unnamed: 30,Unnamed: 31,Unnamed: 32,Unnamed: 33,Unnamed: 34,Unnamed: 35,Unnamed: 36,Unnamed: 37,Unnamed: 38,Unnamed: 39,Unnamed: 40,Unnamed: 41,Unnamed: 42,Unnamed: 43,Unnamed: 44,Unnamed: 45,Unnamed: 46,Unnamed: 47,Unnamed: 48,Unnamed: 49,Unnamed: 50,Unnamed: 51,Unnamed: 52,Unnamed: 53,Unnamed: 54
text_01a708dc522fbe599b22528ac5c5d3c2.txt,01a708dc522fbe599b22528ac5c5d3c2,日本公司计划在肯尼亚大规模生产生物柴油 生物能源 | 39康复网 | 医源世界,https://www.39kf.com/yyjj/biotechnology/03/2007-11-21-431005.shtml,"生物能源,日本公司计划在肯尼亚大规模生产生物柴油,日本 计划 肯尼亚 生产 ",日本公司计划在肯尼亚大规模生产生物柴油属于生物能源栏目，主要讲述了据“中央社”报道，日本生物柴油制造商Biwako(琵琶湖生物实验公司)，在肯尼亚进行四天实地考察后，于内罗毕召开记者会表示，该公司计划在半年内栽种面积达三万公顷的麻疯树(又称木花生)，一旦开始投入商业生产，每年将可制造出二十万吨生物柴油。肯尼亚第一大报《民族报》十九日报道，Biwako社长林光男表示，在肯尼亚进行...。本文重点关注日本 计划 肯尼亚 生产 等内容，您可以在本页对日本公司计划在肯尼亚大规模生产生物柴油进行讨论,中新网,,2007/11/21,2007.0,39kf.com,,,,,,zh,日本,,,,,,,,,,,,,,,,,,,,,,,,,,,,,,,,,,,,,,
text_950bec6aa3d5ff7e854ea43cc6c65934.txt,950bec6aa3d5ff7e854ea43cc6c65934,日本决定新能源战略 2030年代实现零核电 - 日本通,https://www.517japan.com/viewnews-60150.html,a:4:{i:0;s:12:,日本政府14日正式决定了新的能源环保战略，将在2030年代实现零核电。,,,2012/9/15,2012.0,517japan.com,,6.6w,,,,zh,日本,,,,,,,,,,,,,,,,,,,,,,,,,,,,,,,,,,,,,,
text_9d3160991a4e9c43c3f0eb61ffe9f954.txt,9d3160991a4e9c43c3f0eb61ffe9f954,日立集团召开公开说明会，以进一步扩大“脱碳业务” - 日本通,https://www.517japan.com/viewnews-109635.html,日立集团 脱碳业务,9月24日，日立制作所面向全体投资家和新闻媒体，在东京召开了有关脱碳业务的公开说明会。,,,2019/9/25,2019.0,517japan.com,,8.5w,,,,zh,日本 ,,,,,,,,,,,,,,,,,,,,,,,,,,,,,,,,,,,,,,
text_0373f863c6d5a39261a8fd1ea0a3da11.txt,0373f863c6d5a39261a8fd1ea0a3da11,脱碳不积极，日本再次获得“化石奖” - 日本通,https://www.517japan.com/viewnews-111226.html,化石奖,11日，日本和巴西两国因脱碳消极，再次获得“气候行动网络”颁发的“化石奖”。,,,2019/12/12,2019.0,517japan.com,,9.9w,,,,zh,日本 ,,,,,,,,,,,,,,,,,,,,,,,,,,,,,,,,,,,,,,
text_857c12ac1474f8d33575c137e827b4cc.txt,857c12ac1474f8d33575c137e827b4cc,日本的循环经济发展之路 - 日本通,https://www.517japan.com/viewnews-109829.html,循环经济，资源，再生，再利用，废弃，生产，,9月12日，日本一般社团法人CIRCULAR ECONOMY JAPAN在东京御茶之水举办了成立纪念研讨会。本次研讨会中分享了5家企业先行展开的循环经济活动成果，为今后日本循环经济的发展提供新可能性。,,,2019/10/5,2019.0,517japan.com,,10w,,,,zh,日本,,,,,,,,,,,,,,,,,,,,,,,,,,,,,,,,,,,,,,
text_72f669efb5ca9844bf3ec898bb47394d.txt,72f669efb5ca9844bf3ec898bb47394d,为鼓励节能减排 韩国推出“绿色低碳信用卡”,https://www.51credit.com/creditcard/hangye/guonei/20084.shtml,为鼓励节能减排 韩国推出“绿色低碳信用卡”,,新华网,,2010/12/30,2010.0,51credit.com,,,,,,zh,韩国,,,,,,,,,,,,,,,,,,,,,,,,,,,,,,,,,,,,,,
text_8cf772fe5885409f8778148433ea604b.txt,8cf772fe5885409f8778148433ea604b,韩国江原道春川市欲利用区块链技术减少碳排放 - 币界网,https://www.528btc.com/bkuaixun/56642.html,韩国江原道春川市欲利用区块链技术减少碳排放,据prnewswire8月16日报道，韩国江原道春川市正与一家基于区块链的能源平台合作以减少碳排放，推动该市经济和环境的可持续发展。 该基于区块链能源平台的相关负责人表示这一合作伙伴关系旨在解决能源短缺问题，同时激励这座城市的基础设施建设，因为这座城市已准备好减少对化石燃料的依赖。...,,,2018/8/20,2018.0,528btc.com,,32,,,,zh,韩国,,,,,,,,,,,,,,,,,,,,,,,,,,,,,,,,,,,,,,
text_5b020c4b08fc54aa03f8f3c78056dd83.txt,5b020c4b08fc54aa03f8f3c78056dd83,沙特望成为全球最大氢能供应商，10年内出口400万吨氢气,https://fj.52hrtt.com/cn/n/w/info/F1632801628167,",华人头条,新闻",沙特能源大臣阿卜杜勒-阿齐兹·本·萨勒曼（AbdulazizbinSalman）于当地时间10月24日表示，沙特希望成为全球最大的氢能供应商。据路透社24日报道，阿卜杜勒阿齐兹当日表示，沙特阿拉伯希望成为全球最大的氢能供应商。作为世界上最大的石油出口国，沙特计划到2030年生产和出口约400万吨氢气能源。电动汽车制造也是沙特未来计划的一部分。报道称，国际上有越来越多有关减少化石燃料投资，并将重点转,,,2021/10/25,2021.0,52hrtt.com,,4.3w,,,,zh,沙特,,,,,,,,,,,,,,,,,,,,,,,,,,,,,,,,,,,,,,
text_3489cae593b61e14340e60bfa460676f.txt,3489cae593b61e14340e60bfa460676f,韩国总统文在寅在埃及-韩国绿色经济与未来商务会议圆桌会议上发表了讲话,http://xby.52hrtt.com/cn/n/w/info/D1642394444811,",华人头条,新闻",文在寅在讲话开始时感谢埃及总理莫斯塔法·马布利博士的热情接待。他还欢迎双方的商人，表示希望这次会议将是一次良好的机会，以巩固我们两国在过去几年中所建立的信任和友谊，并为两国的光明未来做好准备。韩国总统指出，由于20世纪70年代以来的持续合作，埃及和韩国之间的贸易往来额每年约为20亿美元，韩国投资额约为8亿美元，在埃及经营的韩国公司增加到33家，埃及人对韩国汽车非常感兴趣，这反映了两国积极的经济合作,,,2022/1/22,2022.0,52hrtt.com,,4000,,,,zh,韩国,,,,,,,,,,,,,,,,,,,,,,,,,,,,,,,,,,,,,,
text_23dcac5836b4daf93664b16ab26ae78c.txt,23dcac5836b4daf93664b16ab26ae78c,日本NYK Line：与印尼石油天然气公司合资成立运输能源公司 | 物流报,https://www.56tim.com/archives/124550,"互联网,印度,物流,航运,船舶",近日日本NYK Line正式发布声明称已经与印尼国有石油天然气公司PT Pertamina (Persero)的全资子公司PT Pertamina International Shipping (PIS)就成立一家合资能源运输公司达成谅解备忘录。,,suifeng,2019/12/4,2019.0,56tim.com,,2053,,,,zh,印尼,,,,,,,,,,,,,,,,,,,,,,,,,,,,,,,,,,,,,,
text_0bd116ddaaef2e9d69ab716487934cbd.txt,0bd116ddaaef2e9d69ab716487934cbd,韩机械业界宣布共同参与实现“2050碳中和”目标-财经/股票-文章-小虾米,http://www.580-8.com/news/news-show-597318.htm,"韩机械业界宣布共同参与实现“2050碳中和”目标,机械行业,自由贸易,积极响应,建设机械,2050,产业协会,新技术,资源部,文在寅,财经导读,国内经济,国际经济,财经/股票,视频,小视频,语音朗读资讯,小虾米",《先驱经济》4月1日报道，韩国产业通商资源部和机械业界4月2日在全北金堤自由贸易管理院举行了“机械业界2050碳中和共同宣言仪式”，机械行业表示，积极响应文在寅政府2050碳中和目标，将开发提高能源效率的新技术，减少化石燃料的使用。 韩国机械产业振兴会、建设机械产业协会、机床产业协会等10多个主要协会和机关代表参加了此次活动，会议强调将加强产、学、研、官...,中国经济网?,,2021/4/3,2021.0,580-8.com,,197,,,,zh,韩国,,,,,,,,,,,,,,,,,,,,,,,,,,,,,,,,,,,,,,
text_e0b527d03f8a9f4ad03653b5b7ef5744.txt,e0b527d03f8a9f4ad03653b5b7ef5744,韩国拟投入40万亿韩元发展新型可再生能源,http://news.66wz.com/system/2010/10/15/102124397.shtml,"可再生能源 韩国 韩元,温州网",韩国拟投入40万亿韩元发展新型可再生能源，温网，新闻，体育，娱乐，交友，旅游，文化，论坛，短信，数码，汽车，手机，财经，科技，温州地区门户网站,中国经济网(北京),,2010/10/15,2010.0,66wz.com,,,,,,zh,韩国,,,,,,,,,,,,,,,,,,,,,,,,,,,,,,,,,,,,,,
text_f3939724ae61afb057753d0d2cbc1c1d.txt,f3939724ae61afb057753d0d2cbc1c1d,韩总理开启中南亚三国之旅 进行为期6天访问-新闻中心-温州网,http://news.66wz.com/system/2016/05/19/104833050.shtml,"韩|总理|中南亚,温州网",温州网 - 温州市的网上新闻发布中心、公众信息服务中心和对外宣传的窗口。融新闻、论坛、博客、微博、资讯、财经房产、时尚娱乐、旅游远足、教育培训、短信服务、免费邮箱、互动直播、在线多媒体点播等各类信息和功能于一体。,中国新闻网,,2016/5/19,2016.0,66wz.com,,,,,,zh,韩国,,,,,,,,,,,,,,,,,,,,,,,,,,,,,,,,,,,,,,
text_4ac5b582737c8f7bb8536299e7b7d308.txt,4ac5b582737c8f7bb8536299e7b7d308,日本鼎力打造创新、低碳、高效的世界级钢企（3）???国际热点启示???特稿???宣讲家网,http://www.71.cn/2014/0923/781991_3.shtml,"日本,低碳,钢铁业,节能减排,日本鼎力打造创新、低碳、高效的世界级钢企（3）",在世界钢铁行业不景气的大背景下，日本钢铁企业近年来通过兼并重组、整顿改革、开拓创新、减排节能等措施，鼎力打造创新、低碳和高效的世界级钢铁企业，并逐步恢复了国际竞争力，取得了不俗的成绩，呈现出柳暗花明的景象。,,,2014/9/23,2014.0,71.cn,,,,,,zh,日本,,,,,,,,,,,,,,,,,,,,,,,,,,,,,,,,,,,,,,
text_85eb6c99f45369a4c87f96d4f938d245.txt,85eb6c99f45369a4c87f96d4f938d245,日本可再生能源利用在调整中前行???国际热点启示???特稿???宣讲家网,http://www.71.cn/2014/0916/781308.shtml,"日本,可再生能源,核电站,石油,日本可再生能源利用在调整中前行",日本能源资源十分匮乏。受东日本大地震影响，日本的核电站已全部停止运转，目前其能源自给率只有４．４％，即使所有的核电站全部正常发电，其自给率也只能达到１９．５％。日本从上世纪６０年代就注重能源消费的多元化，积极开展替代能源开发。,,,2014/9/16,2014.0,71.cn,,,,,,zh,日本,,,,,,,,,,,,,,,,,,,,,,,,,,,,,,,,,,,,,,
text_f004dc6564f6d487948d843f55d4ebf0.txt,f004dc6564f6d487948d843f55d4ebf0,日本清洁能源政策转向氨产业和氨燃料，氢能发展“王牌”地位被取代,https://www.aisoutu.com/a/1334522,日本清洁能源政策转向氨产业和氨燃料，氢能发展“王牌”地位被取代,,,,2021/12/25,2021.0,aisoutu.com,,,,,,zh,日本,,,,,,,,,,,,,,,,,,,,,,,,,,,,,,,,,,,,,,
text_dba3fce45a991e2000796762f8a331cc.txt,dba3fce45a991e2000796762f8a331cc,沙特王储启动了沙特首个核电站项目 | 新闻 | 半岛电视台,https://chinese.aljazeera.net/news/2018/11/6/bin-salman-launches-saudi-arabias-first-nuclear-plant-project,"新闻, 沙特阿拉伯",11月5日，王储穆罕默德·本·萨勒曼访问阿卜杜勒阿齐兹国王科技城，启动了在可再生能源，原子能，海水淡化，基因医学和飞机制造业等方面的七个战略项目。,半岛电视台＋通讯社,,2018/11/6,2018.0,aljazeera.net,,,,,,zh,沙特,,,,,,,,,,,,,,,,,,,,,,,,,,,,,,,,,,,,,,
text_2a76d23a06d4abe27eadf679fefb7f33.txt,2a76d23a06d4abe27eadf679fefb7f33,日本最大规模风力发电站在长崎竣工,http://www.aqzyzx.com/system/2013/10/29/006406209.shtml,日本最大规模风力发电站在长崎竣工,日本最大规模风力发电站在长崎竣工,中国网,,2013/10/29,2013.0,aqzyzx.com,,,,,,zh,日本,,,,,,,,,,,,,,,,,,,,,,,,,,,,,,,,,,,,,,
text_85aa0ec72cc957c9332275e58be9a824.txt,85aa0ec72cc957c9332275e58be9a824,文在寅宣布韩国将大力投资新能源汽车 带来十五万就业岗位,https://chejiahao.autohome.com.cn/info/6880054,"文在寅宣布韩国将大力投资新能源汽车 带来十五万就业岗位,行业动向,新能源车",车家号的网友，大家好！今天选车网为您带来韩国新能源汽车的最新消息，请点击关注选车网，第一时间了解最新,,,2020/9/10,2020.0,autohome.com.cn,,27,,,,zh,韩国,,,,,,,,,,,,,,,,,,,,,,,,,,,,,,,,,,,,,,
text_cd10c8fefc3a099e6750bce58fd895d2.txt,cd10c8fefc3a099e6750bce58fd895d2,沙特发布氢动力车辆技术法规草案,https://www.auto-testing.net/news/show-113020.html,"沙特发布氢动力车辆技术法规草案,汽车检测行业资讯","继2019 年7月，阿联酋标准化和计量管理局(""ESMA"")宣布已完成氢动力车辆技术法规草案后，近期沙特标准、计量和质量组织(""SASO"")提交了氢动力车辆技术法规草案，作",车合规CVRegs,,2021/12/1,2021.0,auto-testing.net,,,,,,zh,沙特,,,,,,,,,,,,,,,,,,,,,,,,,,,,,,,,,,,,,,
text_39bdb6fcef492fcd0272ceb863df9000.txt,39bdb6fcef492fcd0272ceb863df9000,排名-日本电改催生市电公司意义大：14个城市已建清洁能源电力公司,http://dlut.yjs.baidajob.com/article-673004.html,电力，电力招聘网，电力人才网，电力人才招聘网,随着日本电力市场从2016年开始全面放开，该国城市和乡镇创建并运营的电力公司应运而生。进入后福岛时代，这些市级电力公司被赋予了很高期待，为了最大程度减轻对外国能源的依赖，同时摆脱,北极星智能电网,吕恒鹏,2022/1/18,2022.0,baidajob.com,,,,,,zh,日本,,,,,,,,,,,,,,,,,,,,,,,,,,,,,,,,,,,,,,
text_71647051ce452675d894924c246ad9a9.txt,71647051ce452675d894924c246ad9a9,世界最大！日本对外公开新型海上风力发电设施安装作业船,http://baijiahao.baidu.com/s?id=1717302776274952609&wfr=spider&for=pc,世界最大！日本对外公开新型海上风力发电设施安装作业船,,人民网-日本频道,,2021/11/24,2021.0,baidu.com,,,,,,zh,日本,,,,,,,,,,,,,,,,,,,,,,,,,,,,,,,,,,,,,,
text_a181d675c3dd5d2bec7027e847a212ef.txt,a181d675c3dd5d2bec7027e847a212ef,韩国计划投资950亿美元开发清洁能源项目,http://baijiahao.baidu.com/s?id=1672439932689874905&wfr=spider&for=pc,韩国计划投资950亿美元开发清洁能源项目,,中国石油网,,2020/7/17,2020.0,baidu.com,,,,,,zh,韩国,,,,,,,,,,,,,,,,,,,,,,,,,,,,,,,,,,,,,,
text_27e3dc077f52aa82739d3088c681abbd.txt,27e3dc077f52aa82739d3088c681abbd,沙特150亿美元绿洲改造项目 为全球合作与投资保驾护航,http://baijiahao.baidu.com/s?id=1705222954492858351&wfr=spider&for=pc,沙特150亿美元绿洲改造项目 为全球合作与投资保驾护航,,新华网,,2021/7/14,2021.0,baidu.com,,,,,,zh,沙特,,,,,,,,,,,,,,,,,,,,,,,,,,,,,,,,,,,,,,
text_e34185bc3f5f37b23110b3da8f488a7d.txt,e34185bc3f5f37b23110b3da8f488a7d,日本能源基本计划草案的雄心勃勃发展目标 ,https://cpu.baidu.com/pc/1022/275122716/detail/53542434419857966/news?chk=1,日本能源基本计划草案的雄心勃勃发展目标,日本能源基本计划草案的雄心勃勃发展目标 【为配合菅义伟首相4月提出的至2050年日本实现“碳中和”目标，日本提出野心勃勃的突出低碳的“能源基本计划草案”——2030年度国内电源比例中：可再生能源比例提至36 ~ 38%，与占比20~22%的核能发电合计占“脱碳化”总量的约6成。】7月16日，日本政府公布了正在修订中的“能源基本计划草案”。按照该草案，在2030年度日本的总发电量中，太阳能和风力等可再生能源的比例将从目前计划的22 ~ 24%提高到36 ~ 38%。核能发电继续维持在20 ~ 22%。该计划草案的最大目标是将可再生能源和核能结合起来，构成总电源中约6成的不排放二氧化碳的“脱碳电源”。实现“可再生”，扶桑在发力，迈向“碳中和”，东瀛在行动。 应该说，此次公布的“能源基本计划草案”体现了日本中长期能源政策的方向性——扩大可再生能源比重，维持核能支撑比重，开发新型绿色能源。菅义伟首相在今年4月下旬提出了到2030年为止，日本的温室气体排放量比2013年减少46%的目标，2050年实现排放为零的“碳中和”。为此，日本如何定位和推动可再生能源和核能相互支撑，联袂发展成为了焦点。根据该草案，预计2030年的日本总发电量为9340亿千瓦时。预计工厂为代表的产业界和办公大楼等的节能效率进一步提升，将比2018年公布的正在实施的计划节能约一成。 该草案最大限度突出可再生能源的增长目标。明确表示“将最大限度地促进可再生能源作为主力电源”，并提出了增加约3310亿~3500亿千瓦时的可再生能源的推进目标。特别是提及要将海上风力发电作为可再生能源成为主力电源的“王牌”，大范围引进海上风能项目，拓展相关企业的上下游衔接。鉴于可供可再生能源的另外的主力电源——太阳能和陆上风力发电的土地资源越来越少，将通过设定特定吸引区域和将荒废农地转用陆上风力发电等具体推进。鉴于技术革新使风力发电成本已经低于核能发电成本，今后将成为日本能源中占比潜力较大的扩充领域。作为日本国民较为关注的核能定位，草案提及“在确保安全性的前提下维持其作为重要的基本主干电源地位”，但没有标明是否新增设和改建核电站的数量。日本政府将于本月21日公布修改后的草案，通过向社会各界征求意见，拟在今年秋季前的内阁会议上敲定最终计划。,,,2021/7/17,2021.0,baidu.com,,,,,,zh,日本,,,,,,,,,,,,,,,,,,,,,,,,,,,,,,,,,,,,,,
text_6590c4400f7009f3706cbc5861a5ced6.txt,6590c4400f7009f3706cbc5861a5ced6,日本政府正式批准可再生能源激励措施 - 生物产业专区 - 生物谷,https://news.bioon.com/article/6553515.html,|可再生能源|,6月18日，日本政府正式批准可再生能源激励措施，此举可能将释放数十亿美元的清洁能源投资需求，帮助这个全球第三大经济体降低对核电的依赖。 日本经济产业大臣枝野幸男批准了上网电价补贴机制，意味着可再生能源将获得较高的补贴。里昂证券预计，此举将帮助可再生能源发电及相关设备制造营收到2016年扩大至300亿美元。 将于7月1日开始实施的上网电价补贴是日本能源版图中仅有的确定之事。,新华网,,2012/6/19,2012.0,bioon.com,,,,,,zh,日本 ,,,,,,,,,,,,,,,,,,,,,,,,,,,,,,,,,,,,,,
text_57bbaf7369c3f085f8d6128363eb469a.txt,57bbaf7369c3f085f8d6128363eb469a,日本索尼公司和南京大学签订合作研究项目 - 生物能源政策专区 - 生物谷,https://www.bioon.com/article/6530517.html,|能源|,10月18日，南京大学环境材料与再生能源研究中心与日本索尼公司“太阳能转换二氧化碳为可再生碳氢燃料”合作研究项目签约仪式在唐仲英楼报告厅举行。南京大学副校长杨忠、物理学院负责人，日本索尼公司Tadafusa Tomitaka总裁、日本索尼公司中国研究院总监李勇明博士以及环境材料与再生能源研究中心全体师生出席签约仪式。,南京大学,,2011/11/4,2011.0,bioon.com,,,,,,zh,日本 ,,,,,,,,,,,,,,,,,,,,,,,,,,,,,,,,,,,,,,
text_6e92edb28759a7a32f51360edab87cac.txt,6e92edb28759a7a32f51360edab87cac,韩国光伏储能市场剖析 储能装机量占全球储能增量的1/2 -  北极星储能网,https://chuneng.bjx.com.cn/news/20181219/950310.shtml,"韩国光伏储能市场剖析 储能装机量占全球储能增量的1/2,光伏储能,储能电站,韩国储能市场",韩国光伏储能市场剖析 储能装机量占全球储能增量的1/2，2017年12月20日，韩国宣布了2030年可再生能源计划，拟将可再生能源的比例从如今的7%提高到2030年的20%，即目标是到2030年要达到63.8GW的可再生能源装机，而目前这一数字仅为15.1GW。未来新增的可再生能源装机63%是光,Coco Fu EnergyVoice,,2018/12/19,2018.0,bjx.com.cn,,,,,,zh,韩国,,,,,,,,,,,,,,,,,,,,,,,,,,,,,,,,,,,,,,
text_e0acdc09942a568a8f999c8376bc32e1.txt,e0acdc09942a568a8f999c8376bc32e1,韩国、欧洲、日本氢能发展规划 - 北极星氢能网,https://chuneng.bjx.com.cn/news/20190802/997351.shtml,"韩国、欧洲、日本氢能发展规划,氢能,氢燃料电池,氢燃料电池汽车",韩国、欧洲、日本氢能发展规划，氢能被视为21世纪最具发展潜力的清洁能源。2019年1—3月，韩国、欧盟和日本陆续发布了氢能领域的最新规划。一、韩国政府出台《氢能经济发展路线图》2019年1月，韩国政府发布《氢能经济发展路线图》，希望以氢燃料电,科技中国,吴善略 张丽娟,2019/8/2,2019.0,bjx.com.cn,,,,,,zh,日本,,,,,,,,,,,,,,,,,,,,,,,,,,,,,,,,,,,,,,
text_aae9f690a06da71ec247519320c08f87.txt,aae9f690a06da71ec247519320c08f87,川崎汽船和川崎重工 壳牌等公司组成日本关西氢能利用委员会 - 北极星氢能网,https://chuneng.bjx.com.cn/news/20200908/1102668.shtml,"川崎汽船和川崎重工 壳牌等公司组成日本关西氢能利用委员会,氢能,氢能热电联产,日本氢能",川崎汽船和川崎重工 壳牌等公司组成日本关西氢能利用委员会，许多日本的能源公司已联手在日本的神户/关西地区打造了氢能供应链。在一份声明中，川崎汽船株式会社指出他们和其它公司一起组成了神户/关西的氢能利用委员会HydrogenUtilizationCouncil。（来源：微信公众号“hydrog,hydrogenfuelcellinfo,B & C?,2020/9/8,2020.0,bjx.com.cn,,,,,,zh,日本,,,,,,,,,,,,,,,,,,,,,,,,,,,,,,,,,,,,,,
text_bc8a363eae39581159f7c7545371091b.txt,bc8a363eae39581159f7c7545371091b,日本加速氢项目研发 - 北极星氢能网,https://chuneng.bjx.com.cn/news/20210616/1158556.shtml,"日本加速氢项目研发,氢能,日本氢能,绿氢",日本加速氢项目研发，近日，日本政府表示，将从绿色创新基金中拨款至多3700亿日元(约合218亿元人民币)用于2个氢项目，以在未来10年加速研发和促进氢的使用。日本政府表示，国有研发机构新能源和工业技术开发组织(NEDO)开始接受两个氢项目,中国化工报吴班,,2021/6/16,2021.0,bjx.com.cn,,,,,,zh,日本,,,,,,,,,,,,,,,,,,,,,,,,,,,,,,,,,,,,,,
text_4a64916ce259d1a498c42c6a4bc817a6.txt,4a64916ce259d1a498c42c6a4bc817a6,观察 | 东京绿色奥运会与日本的氢能野心 - 北极星氢能网,https://chuneng.bjx.com.cn/news/20210803/1167505.shtml,"观察 | 东京绿色奥运会与日本的氢能野心,氢气,氢能,日本氢能",观察 | 东京绿色奥运会与日本的氢能野心，7月23日，当奥运圣火在日本国家体育场点燃时，这不仅标志着奥运会的开始，还标志着日本迈向可持续未来的新篇章。这座充满活力的白色结构由日本设计工作室Nendo设计，根据太阳的形状，由十块铝板组成球形，内部带有反,氢能源网,,2021/8/3,2021.0,bjx.com.cn,,,,,,zh,日本,,,,,,,,,,,,,,,,,,,,,,,,,,,,,,,,,,,,,,
text_e27a03bb7ecba12680497220abb44402.txt,e27a03bb7ecba12680497220abb44402,力争2025年完成液氢商业化实证实验 日本寻求打造全球化氢能源供应链 - 北极星氢能网,https://chuneng.bjx.com.cn/news/20211116/1188202.shtml,"力争2025年完成液氢商业化实证实验 日本寻求打造全球化氢能源供应链,氢能,液氢,日本氢能",力争2025年完成液氢商业化实证实验 日本寻求打造全球化氢能源供应链，在世界主要国家纷纷确立碳中和目标、致力于实现能源转型的背景下，日本正稳步推进氢能技术研发，尝试打造全球化氢能源供应链，探索构筑氢能社会，希望在氢能领域占得技术与市场先机。由于燃烧时不排放二氧化碳，氢被,新华网?,,2021/11/16,2021.0,bjx.com.cn,,,,,,zh,日本,,,,,,,,,,,,,,,,,,,,,,,,,,,,,,,,,,,,,,
text_f5f90312bd5399499cbe70587b7341d0.txt,f5f90312bd5399499cbe70587b7341d0,韩国六部委合作制定氢能经济技术路线 -  北极星储能网,https://chuneng.bjx.com.cn/news/20190305/966593.shtml,"氢能,氢储能,韩国氢能市场",韩国六部委合作制定氢能经济技术路线，近日，韩国科学和信息通信技术部宣布将与经济和财政部，贸易工业能源部，环境部，土地部，基础设施和运输部以及海洋和渔业部合作制定氢能经济技术路线图。据悉，各部门将细分每个类别以提出技术分类，并且将在每个细,太平洋汽车网,,2019/3/5,2019.0,bjx.com.cn,,,,,,zh,韩国,,,,,,,,,,,,,,,,,,,,,,,,,,,,,,,,,,,,,,
text_fe1cc1b346e77db074adc2876aa6c186.txt,fe1cc1b346e77db074adc2876aa6c186,可再生能源发电比例上调15%！ 韩国光伏储能将获大发展 -  北极星储能网,https://chuneng.bjx.com.cn/news/20190423/976518.shtml,"可再生能源发电比例上调15%！ 韩国光伏储能将获大发展,可再生能源,光伏储能,储能",可再生能源发电比例上调15%！ 韩国光伏储能将获大发展，韩国在2017年曾提出可再生能源的3020计划，其目标是到2030年，可再生能源占总能源消耗比例达到20%。为实现这一目标，在此期间需要增加48.7GW的可再生能源装机容量，最终达到63.8GW的装机规模，其中风电占比28%、光伏,新能情报局,,2019/4/23,2019.0,bjx.com.cn,,,,,,zh,韩国,,,,,,,,,,,,,,,,,,,,,,,,,,,,,,,,,,,,,,
