fileId,orgin_fileId,title,url,keywords,description,source,author,date,year,domainName,websiteName,views,comments,likes,forwardings,language,area,title_in_article,news_category,Unnamed: 19,Unnamed: 20,Unnamed: 21,Unnamed: 22,Unnamed: 23,Unnamed: 24,Unnamed: 25,Unnamed: 26,Unnamed: 27,Unnamed: 28,Unnamed: 29,Unnamed: 30,Unnamed: 31,Unnamed: 32,Unnamed: 33,Unnamed: 34,Unnamed: 35,Unnamed: 36,Unnamed: 37,Unnamed: 38,Unnamed: 39,Unnamed: 40,Unnamed: 41,Unnamed: 42,Unnamed: 43,Unnamed: 44,Unnamed: 45,Unnamed: 46,Unnamed: 47,Unnamed: 48,Unnamed: 49,Unnamed: 50,Unnamed: 51,Unnamed: 52,Unnamed: 53,Unnamed: 54
text_5a78a1e9529d6dcd86ab93396ea77609.txt,5a78a1e9529d6dcd86ab93396ea77609,未来10年印尼可再生能源比例将提到25%,https://news.bjx.com.cn/html/20160721/753794.shtml,"未来10年印尼可再生能源比例将提到25%,可再生能源,风电市场,风电",未来10年印尼可再生能源比例将提到25%，随着能源需求日益增长，印尼正计划在不久的将来增加可再生能源使用。7月19日，印尼能源及自然资源部长SudirmanSaid表示，未来10年内，政府旨在把可再生能源使用比例从当前的低于10%提高到25%。印尼拥有巨大潜力发展,世纪新能源网,,2016/7/21,2016.0,news.bjx.com.cn,北极星网,,,,,zh,印尼,,,,,,,,,,,,,,,,,,,,,,,,,,,,,,,,,,,,,,
text_a641e619195b4255e68bdbd6f3d080a9.txt,a641e619195b4255e68bdbd6f3d080a9,沙特阿拉伯首次新能源招标：700MW风电和光伏项目 电价有望世界最低,https://news.bjx.com.cn/html/20170204/806314.shtml,"沙特阿拉伯首次新能源招标：700MW风电和光伏项目 电价有望世界最低,风电电价,风电项目,风电",沙特阿拉伯首次新能源招标：700MW风电和光伏项目 电价有望世界最低，据彭博社报道，沙特阿拉伯将于9月份启动首次招标建造700MW光伏和风电项目，而电价有望成为世界最低价。投标资格将在2月20日公布，4月17日开标。据悉，欧佩克最大的石油国有意在沙特北部的Al-Jouf地区建造300MW光伏电,风电News,,2017/2/4,2017.0,news.bjx.com.cn,北极星网,,,,,zh,沙特,,,,,,,,,,,,,,,,,,,,,,,,,,,,,,,,,,,,,,
text_b6ee8bf384bccdfffb0c3c1096815f9c.txt,b6ee8bf384bccdfffb0c3c1096815f9c,韩国拟到2020年投资42万亿韩元发展可再生能源,https://news.bjx.com.cn/html/20160726/755174.shtml,"韩国拟到2020年投资42万亿韩元发展可再生能源,可再生能源,风电市场,韩国风电",韩国拟到2020年投资42万亿韩元发展可再生能源，韩国贸易部长日前表示，韩国将投资42万亿韩元（366亿美元）用于可再生能源领域，为在2020年实现发展环境友好型的供电系统做出努力。韩国贸易、工业和能源部表示，根据计划，新的可再生能源电站将在2020年前完成，每,《电力国际信息参考》,,2016/7/26,2016.0,news.bjx.com.cn,北极星网,,,,,zh,韩国,,,,,,,,,,,,,,,,,,,,,,,,,,,,,,,,,,,,,,
text_bfe165381bcb98ccb72f0279a2b5d53e.txt,bfe165381bcb98ccb72f0279a2b5d53e,韩国发布氢能经济路线图：2040年氢能汽车增加3100倍,https://news.bjx.com.cn/html/20190121/957842.shtml,"韩国发布氢能经济路线图：2040年氢能汽车增加3100倍,氢能,燃料电池,火电",韩国发布氢能经济路线图：2040年氢能汽车增加3100倍，韩国总统文在寅近日在蔚山市政府大楼发布“氢能经济发展路线图”，宣布韩国将大力发展氢能产业，引领全球氢能市场发展。根据该路线图，韩国政府计划到2019年底，在国内普及4000辆以上氢燃料电池汽车；到2025年，建立,科技日报,,2019/1/21,2019.0,news.bjx.com.cn,北极星网,,,,,zh,韩国,,,,,,,,,,,,,,,,,,,,,,,,,,,,,,,,,,,,,,
text_79703f94e02aaa4d5f5a34cb4ae63978.txt,79703f94e02aaa4d5f5a34cb4ae63978,日本吹响“氢能社会”集结号,https://news.bjx.com.cn/html/20190515/980373.shtml,"日本吹响“氢能社会”集结号,氢能,氢燃料发电,热电联产",日本吹响“氢能社会”集结号，发展氢能议题已列入即将于今年6月召开的2019年G20峰会议程，2020年东京奥运会则是日本向国际社会展示其氢能技术发展成果的一场“氢能秀”，2025年大阪世界博览会更是真正检阅日本氢能社会建设成果的“大考”。日本着,中国能源报,,2019/5/15,2019.0,news.bjx.com.cn,北极星网,,,,,zh,日本,,,,,,,,,,,,,,,,,,,,,,,,,,,,,,,,,,,,,,
text_e224f088b7905ce86351c27172ebdec6.txt,e224f088b7905ce86351c27172ebdec6,日本首相安倍晋三鼓励新建核电站（图）,https://news.bjx.com.cn/html/20130105/411532.shtml,"日本首相安倍晋三鼓励新建核电站（图）,核电站,核反应堆,日本",日本首相安倍晋三鼓励新建核电站（图），12月31日电据共同社报道，日本首相安倍晋三31日出演TBS的电视节目时，就今后的核电政策表示：新建的核电站将和发生事故的东京电力公司福岛第一核电站完全不同。(政府)今后将一边争取国民的理解一边建设新的核电站。,中国新闻网,,2013/1/5,2013.0,news.bjx.com.cn,北极星网,,,,,zh,日本,,,,,,,,,,,,,,,,,,,,,,,,,,,,,,,,,,,,,,
text_c1eaad980e6b10477794fbf1193c3376.txt,c1eaad980e6b10477794fbf1193c3376,日本公布可再生能源发展的新战略,https://news.bjx.com.cn/html/20120831/384850.shtml,"日本公布可再生能源发展的新战略,可再生能源,地热发电,发电",日本公布可再生能源发展的新战略，日本政府31日公布了实现可再生能源飞跃发展的新战略，目标是到2030年使海上风力、地热、生物质、海洋(波浪、潮汐)四个领域的发电能力扩大到2010年度的6倍以上。日本环境相细野豪志在当天的记者会上公布了这一新战略,新华网,,2012/8/31,2012.0,news.bjx.com.cn,北极星网,,,,,zh,日本,,,,,,,,,,,,,,,,,,,,,,,,,,,,,,,,,,,,,,
text_9d87a9883b48bb48c81a999e333a6c8e.txt,9d87a9883b48bb48c81a999e333a6c8e,韩国氢能发电遇挑战：存在技术差距 研发投入不足,https://news.bjx.com.cn/html/20190401/972036.shtml,"韩国氢能发电遇挑战：存在技术差距 研发投入不足,氢能,清洁能源,氢能发电",韩国氢能发电遇挑战：存在技术差距 研发投入不足，韩国准备大力推动氢能发电，从而进一步推动以清洁能源取代化石燃料发电。在具体实施过程中，韩国将对用于发电、建筑、交通等方面的氢能源产业给予创业支持，并强化生产力量，构建氢燃料电池产业生态圈，增设相关产业,经济日报,,2019/4/1,2019.0,news.bjx.com.cn,北极星网,,,,,zh,韩国,,,,,,,,,,,,,,,,,,,,,,,,,,,,,,,,,,,,,,
text_36fdecadc956e430f93beeb6d93d3d77.txt,36fdecadc956e430f93beeb6d93d3d77,日本政府通过2030年温室气体比2013年减排26%目标,https://www.antpedia.com/news/04/n-1254204.html,"日本,气体排放,减排",日本政府2日举行“全球气候变暖对策推进本部”会议，通过了2030年温室气体排放要比2013年减少26％的新目标。不过，这个新目标比其他主要发达国家宣布的目标明显要低得多。 虽然日本首相安倍晋三声称日本政府“制定了在国际社会中毫不逊色的雄心勃勃的目标”，但是如果对照作为《京都议定书》基准年的1990年，这个减排目标仅相当于削减18％。作为对比，欧盟提出了20,,,2015.6.04,2015.0,www.antpedia.com,分析测试百科网,116,,0.0,,zh,日本,,,,,,,,,,,,,,,,,,,,,,,,,,,,,,,,,,,,,,
text_7d932def21a061d356806fc17d1a2398.txt,7d932def21a061d356806fc17d1a2398,日本公司表示将继续削减碳排放,https://www.antpedia.com/news/71/n-115171.html,"京都议定书,排放量,技术,气候变化,环境,委员会,碳排放,二氧化碳",日本工业界的代表们表示，即使日本政府反对续签《京都议定书》二期协议而导致坎昆谈判崩溃，他们也将继续削减温室气体排放量。 行业官员称，在日本的高能源成本以及向新兴市场国家出口清洁能源、节能技术的趋势拉动下，不论政府目标如何，日本工业排放量仍将保持下降势头。 在墨西哥坎昆举行的本轮联合国气候变化谈判，主要分歧仍然在于穷国和富国在应对全球气候变化上的义务。 据路,,,2010.12.13,2010.0,www.antpedia.com,分析测试百科网,507,,1.0,,zh,日本,,,,,,,,,,,,,,,,,,,,,,,,,,,,,,,,,,,,,,
text_e14fcaa2bc493b3c710f3260357a48e3.txt,e14fcaa2bc493b3c710f3260357a48e3,苏格兰和韩国将在可再生能源领域展开合作,https://www.antpedia.com/news/04/n-308104.html,"能源技术,可再生能源,能源",据美国合众国际社5月7日首尔报道，苏格兰政府7日在爱丁堡宣布，苏格兰与韩国签署了一项谅解备忘录，根据这项协议，两国将在海洋能源技术上进行合作。 苏格兰财政部长约翰·斯威尼日前率领一个代表团前往韩国调查两国在可再生能源领域进行合作的潜力。 韩国仁川市绿色政策主管PakrkYoon-soo在一份声明中说，他预计将把苏格兰的可再生能源知识纳入他的规划制度中。潮汐,,,2013.5.10,2013.0,www.antpedia.com,分析测试百科网,80,,0.0,,zh,韩国,,,,,,,,,,,,,,,,,,,,,,,,,,,,,,,,,,,,,,
text_b584b918427af0cab1a34468827b756d.txt,b584b918427af0cab1a34468827b756d,印尼承诺2030年前减少29%碳排放,https://www.antpedia.com/news/98/n-1274798.html,"二氧化碳,碳排放",一位印尼的伐木工正在作业 据《卫报》报道，印度尼西亚环境与林业部长巴卡尔（Siti Nurbaya Bakar）近日表示，印尼将承诺2030年前实现二氧化碳排放减少29%，但是并未给出如何减排的相关细节。 印尼境内的热带雨林覆盖面积位居全球第三，同时印尼还是世界最大的棕榈油生产国。因此，在今年即将召开的联合国巴黎气候大会上，印尼将扮演重要角色。 印尼此前曾,,,2015.9.11,2015.0,www.antpedia.com,分析测试百科网,378,,0.0,,zh,印尼,,,,,,,,,,,,,,,,,,,,,,,,,,,,,,,,,,,,,,
text_e148d974a1c87a8ba3f58c30790cf662.txt,e148d974a1c87a8ba3f58c30790cf662,印尼称2030年能减少70%碳排放,https://www.antpedia.com/news/17/n-95817.html,"气候变化,印尼,温室气体,科学,中国",印度尼西亚气候变化国家委员会最近的一份报告显示，印尼在2030年能用相对较低的成本减少70%的温室气体排放，但是印尼政府还是希望得到发达国家的支持。 报告预测，到2030年，印尼温室气体排放将增加60%，达到33亿吨。但是，通过在林业、水泥、电力、石油天然气、农业、交通和建筑这八大行业采取措施，印尼能削减70%的排放。 报告中提到：“到2030年，印尼温室,,,2010.9.09,2010.0,www.antpedia.com,分析测试百科网,281,,0.0,,zh,印尼,,,,,,,,,,,,,,,,,,,,,,,,,,,,,,,,,,,,,,
text_f8200200e2802dca355198b1172d480f.txt,f8200200e2802dca355198b1172d480f,国家能源局沙特推销核电 国内核电企业各自为战,https://www.antpedia.com/news/98/n-366798.html,"能源,合作,中国,可再生能源,核电,天然气,2011年,国务院,标准",随着上两个月与法国和英国在核能等能源领域合作有了新进展之后，中国最近也与沙特阿拉伯在这方面巩固了战略合作。 本报记者从国家能源局官网在12月16日发布的消息获知，11月29日至12月1日，该局局长吴新雄率团访问沙特阿拉伯，会见了沙特石油矿产部部长纳伊米、核能和可再生能源城主席雅玛尼等，就中沙双方进一步巩固和深化能源战略合作，推进油气、核能、光伏领域合作达成,,,2013.12.17,2013.0,www.antpedia.com,分析测试百科网,122,,0.0,,zh,沙特,,,,,,,,,,,,,,,,,,,,,,,,,,,,,,,,,,,,,,
text_e09c6c4737e51ee8b9ed3753baa60d04.txt,e09c6c4737e51ee8b9ed3753baa60d04,韩国宣布2013年温室气体减排目标,https://www.antpedia.com/news/95/n-276295.html,"温室气体,二氧化碳,标准,排放量",据报道，韩国知识经济部日前公布了2013年温室气体减排计划，并向产业、发电领域的377家企业下达了减排指标。 报道称，以二氧化碳为标准，2013年温室气体排放量预计达5.7亿吨，知识经济部计划限定排放量为5.53亿吨，其中产业、发电领域377家企业的减排量达1720万吨，减幅为3.02%，减排量是今年的2.1倍。 韩国2013年产业领域的温室气体排放量预计,,,2013.1.15,2013.0,www.antpedia.com,分析测试百科网,232,,0.0,,zh,韩国,,,,,,,,,,,,,,,,,,,,,,,,,,,,,,,,,,,,,,
text_6ad22e92871424586bdc387d38115aee.txt,6ad22e92871424586bdc387d38115aee,韩国团队研发出新型环保氢制备技术,https://www.antpedia.com/news/12/n-1477812.html,氢制备,韩国科学技术研究院发布消息称，该院燃料电池研究中心研发出了环保氢制备新技术。研究成果刊登在国际学术刊物《Applied Catalysis B: Environmental》上。 作为应对全球气候变化的重要解决方案，世界各国对氢燃料汽车的关注度越来越高。目前，氢燃料大部分是利用天然气等化石燃料生产而成，污染度较高。现有工艺技术是将粉末进行物理涂抹，在此过程,,,2018.3.29,2018.0,www.antpedia.com,分析测试百科网,53,,,,zh,韩国,,,,,,,,,,,,,,,,,,,,,,,,,,,,,,,,,,,,,,
text_5e3553a9d08487fb3862b7e0b167b2db.txt,5e3553a9d08487fb3862b7e0b167b2db,韩国：低碳绿色推动LED照明产业,https://www.antpedia.com/news/64/n-335864.html,"能源,环保,照明产业,2010年,2011年,2012年",采用LED照明的韩国大型超市。 韩国是一个资源贫国，约97%的能源依赖进口，能源短缺和油价上涨制约着韩国经济和社会的发展。节能已经成为韩国最重要的国家战略之一。因而，具有重大节能和环保意义的LED产业备受韩国政府重视。2008年，韩国就提出将“低碳绿色成长”作为未来的国家战略，而其中LED产业被作为重点推动领域。 大企业参与形成产能 韩国LED照明产业在近些,,,2013.8.21,2013.0,www.antpedia.com,分析测试百科网,112,,0.0,,zh,韩国,,,,,,,,,,,,,,,,,,,,,,,,,,,,,,,,,,,,,,
text_613dd9e30fc46163dbbcd0ac7ab8c901.txt,613dd9e30fc46163dbbcd0ac7ab8c901,东京都提出可再生能源电力新目标：2030年达到30%,https://guangfu.bjx.com.cn/news/20160224/710409.shtml,"东京都提出可再生能源电力新目标：2030年达到30%,可再生能源,太阳能发电,日本光伏市场",东京都提出可再生能源电力新目标：2030年达到30%，东京都2月19日确定，要提出都内利用可再生能源电力的比例到2030年提高至30%左右;的新目标。东京都环境审议会（会长：早稻田大学教授田边新一）提交了题为关于东京都环境基本计划的理想方式的报告，报告中就含有这一,日经BP社,,2016/2/24,2016.0,news.bjx.com.cn,北极星网,,,,,zh,日本,,,,,,,,,,,,,,,,,,,,,,,,,,,,,,,,,,,,,,
text_df5ba726309c6fb6b093fc1300690b95.txt,df5ba726309c6fb6b093fc1300690b95,中国碳交易网,http://www.tanjiaoyi.com/article-32311-1.html,    韩国碳中和目标    韩国碳排放,韩国总统文在寅：今年将拟定长期低碳战略 力争实现2050碳中和目标，韩国总统文在寅在二十国集团领导人峰会第二阶段会议中表示，为实现2050碳中和目标，韩国今年内将拟定长期低碳战略并提交联合国。文在寅介绍说，2050年碳中和是改变产业和 ... ..., KBS                    ,,2020/11/24,2020.0,www.tanjiaoyi.com,碳交易,,,,,zh,韩国,,,,,,,,,,,,,,,,,,,,,,,,,,,,,,,,,,,,,,
text_665d2c46ba26e40ac0c4a2216e6f412a.txt,665d2c46ba26e40ac0c4a2216e6f412a,印度尼西亚拟建设国内首座核电厂,https://www.cnnpn.cn/article/20371.html,"核电,核电厂",2020年7月24日，印度尼西亚驻俄罗斯大使穆罕默德·瓦希德·苏普里亚迪(Mohamad Wahid Supriyad)称，印度尼西亚政府正考虑俄罗斯国家原子能公司(Rosatom)提出的在该国建设首座核电厂的提议。,核电 核电厂 印度尼西亚核电,,2020/7/30,2020.0,www.cnnpn.cn,中国核电网,,,,,zh,印尼,,,,,,,,,,,,,,,,,,,,,,,,,,,,,,,,,,,,,,
text_8f68bb78b59973fc8ec0a9df99edfd60.txt,8f68bb78b59973fc8ec0a9df99edfd60,印尼政府开始考虑使用核电,https://www.cnnpn.cn/article/26391.html,"中国核电网,核电行业新闻,中国核电技术,华龙一号,中国核电站,核电项目,核电新闻",阿里芬就此事确定印尼已准备有关从2021年至2060年净零排放能源过渡时期的线路图。他日前出席由印尼工商会举办的主题为“印尼从净零排放至能源过渡时期的能源转型之路”的线上讨论会说：“其中要实施的主要策略就是在2045年使用核能发电。2060年全国电站电机容装量将达到35吉瓦或3500万千瓦。”,印度尼西亚核电,,2021/11/6,2021.0,www.cnnpn.cn,中国核电网,,,,,zh,印尼,,,,,,,,,,,,,,,,,,,,,,,,,,,,,,,,,,,,,,
text_b221a48a7432a522894ca0d45a2de8c0.txt,b221a48a7432a522894ca0d45a2de8c0,印度尼西亚145MW浮式光伏发电站动工 计划2022年Q4完工,https://guangfu.bjx.com.cn/news/20210810/1168864.shtml,"印度尼西亚145MW浮式光伏发电站动工 计划2022年Q4完工,浮式光伏电站,光伏项目建设,印尼光伏市场",印度尼西亚145MW浮式光伏发电站动工 计划2022年Q4完工，总部设在阿布扎比的可再生能源集团Masdar和印度尼西亚能源公司PTPJB已经为位于西爪哇Cirata水库225公顷水面的145MWCirata浮式光伏电站完成财务结算。两家公司之前于2020年1月与当地国有电力公司PerusahaanListrikNeg,pv magazine,,2021/8/10,2021.0,news.bjx.com.cn,北极星网,,,,,zh,印尼,,,,,,,,,,,,,,,,,,,,,,,,,,,,,,,,,,,,,,
text_459911bd2c9180c73a7314db79f1f480.txt,459911bd2c9180c73a7314db79f1f480,印尼光伏市场及政策简析,https://guangfu.bjx.com.cn/news/20171025/857533.shtml,"印尼光伏市场及政策简析,光伏发电,可再生能源发电,印度尼西亚光伏市场",印尼光伏市场及政策简析，随着光伏行业的发展，受制于当地消纳及电力传输等制约，国内地面电站的新增数量已明显下降。与此同时越来越多的光伏企业开始把目光投向海外，在此过程中，由于地理位置靠近中国，东南亚的一些国家受到中国企业的关注,PV兔子,,2017/10/25,2017.0,news.bjx.com.cn,北极星网,,,,,zh,印尼,,,,,,,,,,,,,,,,,,,,,,,,,,,,,,,,,,,,,,
text_312d4ecb5baf10bd296435f792377214.txt,312d4ecb5baf10bd296435f792377214,太阳能公司在印尼与可再生能源政策斗争,https://guangfu.bjx.com.cn/news/20190813/999466.shtml,"太阳能公司在印尼与可再生能源政策斗争,太阳能光伏,屋顶太阳能,印度尼西亚光伏市场",太阳能公司在印尼与可再生能源政策斗争，印度尼西亚的太阳能公司正在努力保持其利润率不变。印度尼西亚政府已宣布到2025年可再生能源目标达到23%。为了推动可再生能源的安装，政府通过不同的部门引入了各种法规。然而，公司正在抗议一些法规，因为他们认为,Power Technology/GlobalData Ener,,2019/8/13,2019.0,news.bjx.com.cn,北极星网,,,,,zh,印尼,,,,,,,,,,,,,,,,,,,,,,,,,,,,,,,,,,,,,,
text_78f7f9731543f3d3125927b411644e04.txt,78f7f9731543f3d3125927b411644e04,全球能源大视野丨印度尼西亚可再生能源储量及开发情况,https://guangfu.bjx.com.cn/news/20200515/1072799.shtml,"全球能源大视野丨印度尼西亚可再生能源储量及开发情况,可再生能源,光伏发电,印度尼西亚光伏市场",全球能源大视野丨印度尼西亚可再生能源储量及开发情况，印度尼西亚位于亚洲东南部（东经94°45′~141°05′，北纬6°08′~南纬11°15′），是东南亚面积最大的国家，也是世界重要的海洋国家。印度尼西亚由太平洋和印度洋之间17508个大小岛屿组成，其中约6000个有人居住，,中电传媒数据研发中心,,2020/5/15,2020.0,news.bjx.com.cn,北极星网,,,,,zh,印尼,,,,,,,,,,,,,,,,,,,,,,,,,,,,,,,,,,,,,,
text_09ccfde2851865b3fa868dddc14244dd.txt,09ccfde2851865b3fa868dddc14244dd,沙特2030年清洁能源将增加60GW,https://news.solarbe.com/202005/25/325336.html,"沙特2030年清洁能源将增加60GW,光伏价格,光伏制氢,沙特光伏市场",近期，国际石油市场在新冠肺炎疫情冲击下持续受到需求衰退的压力。但与之不同的是，全球可再生能源的份额却实现逆势增长，据国际能源署(IEA)最新数据显示，2020年第一季度，太阳能光伏和风能发电量占比增大到9%，高,能源发展与政策                ,,2020/5/25,2020.0,news.solarbe.com,索比光伏网,,,,,zh,沙特,,,,,,,,,,,,,,,,,,,,,,,,,,,,,,,,,,,,,,
text_4809b2c73ab77c35404c340a9462ee18.txt,4809b2c73ab77c35404c340a9462ee18,沙特能源部公布1.2GW太阳能光伏项目投标入围名单,https://guangfu.bjx.com.cn/news/20211022/1183168.shtml,"沙特能源部公布1.2GW太阳能光伏项目投标入围名单,光伏招标,光伏发电项目,沙特光伏市场",沙特能源部公布1.2GW太阳能光伏项目投标入围名单，沙特阿拉伯能源部公布了从开发商那里收到的参与该国第三阶段可再生能源项目的投标入围名单。三期包括四个太阳能光伏项目，总装机容量为1.2GW。第三阶段分为两类——A类包括120MWWadiAdDawasir和80MWLayla太阳能项目,电缆网,,2021/10/22,2021.0,news.bjx.com.cn,北极星网,,,,,zh,沙特,,,,,,,,,,,,,,,,,,,,,,,,,,,,,,,,,,,,,,
text_65962683857e46494bf9cbe0fa630370.txt,65962683857e46494bf9cbe0fa630370,沙特1.2GW光伏组件工厂投产,https://guangfu.bjx.com.cn/news/20211123/1189481.shtml,"沙特1.2GW光伏组件工厂投产,光伏组件,光伏市场,沙特光伏市场",沙特1.2GW光伏组件工厂投产，沙特电力公司BinOmairahHolding位于沙特阿拉伯西北部Tabuk地区首府Tabuk工业区投资总额为7亿里亚尔（合1.869亿美元）的1.2GW太阳能组件装配厂投产。据悉，这家工厂将主要生产M3全电池板、M10半切电池，以及采用1/3切,北极星太阳能光伏网,,2021/11/23,2021.0,news.bjx.com.cn,北极星网,,,,,zh,沙特,,,,,,,,,,,,,,,,,,,,,,,,,,,,,,,,,,,,,,
text_5a1218a4beb6d41c96d3a6c6ea308ae9.txt,5a1218a4beb6d41c96d3a6c6ea308ae9,沙特将于明年7月起提供太阳能光伏能源服务,https://guangfu.bjx.com.cn/news/20170828/845938.shtml,"沙特将于明年7月起提供太阳能光伏能源服务,太阳能发电,光伏发电,沙特光伏市场",沙特将于明年7月起提供太阳能光伏能源服务，据沙特电力当局透露，沙特电力公司SEC将于2018年中期开始向用户提供太阳能光伏能源服务。沙特电力公司表示，公司已经组织一批专家和技术人员正致力于开展该项目所需的系统和技术设计。自9月17日起，有意向的用户就可,电缆网,,2017/8/28,2017.0,news.bjx.com.cn,北极星网,,,,,zh,沙特,,,,,,,,,,,,,,,,,,,,,,,,,,,,,,,,,,,,,,
text_beafd2ad6ce6fcc5ff336c66e13f27cc.txt,beafd2ad6ce6fcc5ff336c66e13f27cc,沙特的能源“豪赌”：赌国家未来，还是国际油价？,https://new.qq.com/omn/20211217/20211217A0BS9H00.html,"沙特的能源“豪赌”：赌国家未来，还是国际油价？,能源,国际油价,石油,可再生能源,沙特阿拉伯_财经",关于沙特阿拉伯，在今年十月份有一条重磅新闻，那就是——在当地时间的10月23日，沙特阿拉伯在利雅得召开的一次气候会议上承诺，将在2060年实现净零排放，并将年度碳减排量的目标提高一倍。作为全球最大石……,,,2021/12/18,2021.0,new.qq.com,腾讯网,,,,,zh,沙特,,politics,,,,,,,,,,,,,,,,,,,,,,,,,,,,,,,,,,,,
text_82aca21f36db1124950bb88db36f96ed.txt,82aca21f36db1124950bb88db36f96ed,沙特能源战略：以石油为主线 建立核电、可再生能源等多元化发展路径,https://www.xianjichina.com/news/details_98868.html,"石油,核电",石油输出国组织（OPEC）的成立赋予了沙特在国际石油市场中更大的话语权，助其跻身世界舞台、获得更高地区和国际影响力。,中国能源报,,2019/1/23,2019.0,www.xianjichina.com,贤集网,,,,,zh,沙特,,,,,,,,,,,,,,,,,,,,,,,,,,,,,,,,,,,,,,
text_6eae22de3a988a5df9fe7b71d60c34e6.txt,6eae22de3a988a5df9fe7b71d60c34e6,石油大国沙特走上能源转型之路,https://guangfu.bjx.com.cn/news/20170327/816745.shtml,"石油大国沙特走上能源转型之路,可再生能源,太阳能,沙特光伏市场",石油大国沙特走上能源转型之路，近期，沙特政府一系列动向表明，这个石油大国将迅速推进可再生能源计划。该计划的第一阶段包括在塔布克省400兆瓦的风力发电项目、焦夫省300兆瓦的太阳能发电项目。目前还不清楚这些项目是否会分成若干个小项目，但所,中国电力报,,2017/3/27,2017.0,news.bjx.com.cn,北极星网,,,,,zh,沙特,,,,,,,,,,,,,,,,,,,,,,,,,,,,,,,,,,,,,,
text_4c13d59096488b9a57c007f076702e10.txt,4c13d59096488b9a57c007f076702e10,日本众议院大选论战继续 在野党呼吁进一步普及太阳能等可再生能源,https://news.solarbe.com/201710/16/119466.html,"日本众议院大选论战继续　在野党呼吁进一步普及太阳能等可再生能源,可再生能源,太阳能发电,日本光伏市场",据日媒报道，安倍政府把利用核电站作为能源政策的支柱之一，已重启了关西电力高滨核电站3、4号机组(福井县)等5座机组。报道称，然而此次日本众院选举战中却未提及新增设核电站，未来蓝图十分模糊。在野党倡导零核电,中国新闻网                ,,2017/10/16,2017.0,news.solarbe.com,索比光伏网,,,,,zh,日本,,,,,,,,,,,,,,,,,,,,,,,,,,,,,,,,,,,,,,
